{
  "task_understanding": "Create formulas in column G (G2:G19) to calculate employee incentive percentages based on a three-dimensional lookup: (1) Goal value determines which column of variance thresholds to use (4 buckets: <65%, 65-75%, 75-85%, 85-95%, 95%+), (2) Variance to Goal determines which row (4 ranges with different thresholds per goal bucket), and (3) Metric2 determines which column in the payout grid (6 ranges: <=-20%, -20% to -10%, -10% to 0%, 0% to 10%, 10% to 20%, >20%). Employees with negative variance or Goal < 65% receive no incentive.",
  "target_locations": [
    "Sheet1!G2:G19"
  ],
  "proposed_approach": [
    "Use nested IF statements to first check eligibility (B column = 'Not Eligible' returns empty string)",
    "Check if Goal (D column) is >= 0.65, otherwise return empty string",
    "Determine Goal bucket using cascading IF statements (D < 0.75, D < 0.85, D < 0.95, else)",
    "For each Goal bucket, use the corresponding column (J, K, L, or M) to determine Variance range using <= comparisons against thresholds in rows 3, 4, 5, with row 6 as fallback",
    "For each Variance range (rows 3-6), determine Metric2 bucket using cascading IF statements (F <= -0.2, F < -0.1, F < 0, F < 0.1, F < 0.2, else)",
    "Return the corresponding value from the payout grid (columns P-T, rows 3-6)"
  ],
  "assumptions": [
    "The variance thresholds in columns J-M (rows 3-6) represent upper bounds for each variance range, with different thresholds for each goal bucket",
    "The Metric2 thresholds in row 2 (columns P-T) represent lower bounds: -0.2, -0.1, 0, 0.1, 0.2",
    "Values exactly equal to thresholds are included in the lower range (e.g., Metric2 = 0 falls in the 0-10% range, not -10% to 0%)",
    "Employees with Goal < 0.65 receive no incentive (empty string)",
    "The payout grid (P3:T6) contains the final incentive percentages to return",
    "Rows 20-23 (Emp19-Emp22) are outside the answer range and don't need formulas"
  ],
  "observed_feedback": [
    "Solution executed successfully with exit code 0",
    "All 18 employees (G2:G19) received calculated incentive values",
    "Manual verification of Emp1: Goal=0.8427 (75-85% bucket), Variance=0.1113 (>0.06, row 6), Metric2=0.0712 (0-10%, column S) → 0.12 ✓",
    "Manual verification of Emp3: Goal=0.8529 (85-95% bucket), Variance=0.0943 (>0.045, row 6), Metric2=-0.1441 (-20% to -10%, column Q) → 0.07 ✓",
    "Formulas correctly reference the lookup tables with absolute row references ($3, $4, $5, $6) and absolute column references (J$, K$, L$, M$, P$, Q$, R$, S$, T$)"
  ],
  "known_risks": [
    "Complex nested IF formula with many levels may be difficult to debug if issues arise",
    "Edge cases at exact threshold boundaries rely on correct use of <= vs < operators",
    "Formula assumes the lookup table structure remains constant; any changes to table layout would break the formula",
    "Very long formula may have performance implications with large datasets",
    "LibreOffice formula evaluation may differ slightly from Excel in edge cases"
  ],
  "validation_plan": [
    "Verify all 18 employees in G2:G19 have numeric incentive values",
    "Spot-check calculations for employees in different Goal buckets to ensure correct column selection",
    "Verify employees with extreme Metric2 values (very negative or very positive) get correct payouts",
    "Confirm employees with low variance get lower row payouts than those with high variance",
    "Check that the formula structure correctly handles all combinations of Goal, Variance, and Metric2 ranges"
  ]
}
