{
  "task_understanding": "Fill the requested workbook cells.",
  "target_locations": ["Sheet1!A1"],
  "proposed_approach": ["Load input.xlsx and write the target value."],
  "assumptions": [],
  "observed_feedback": ["Candidate executed without error."],
  "known_risks": [],
  "validation_plan": ["Reopen output.xlsx and inspect Sheet1!A1."]
}
